{
  "paper_id": "plugin_test_training_curves",
  "paper_title": "FigureAgent Plugin Test: Training Curve Visualization",
  "target_stage": "experiment_analysis",
  "section_plan": [
    {
      "section_id": "experiments_training_curves",
      "title": "Experiments/Training Curves",
      "expected_figures": ["training_accuracy_line_chart"]
    },
    {
      "section_id": "method_pipeline",
      "title": "Method/Figure Generation Pipeline",
      "expected_figures": ["figure_generation_pipeline"]
    }
  ],
  "analysis_claims": [
    {
      "claim_id": "claim_augmented_training_improves_accuracy",
      "text": "The FigureAgent-augmented method reaches higher validation accuracy than the baseline across training epochs.",
      "target_section": "Experiments/Training Curves",
      "importance": "high",
      "suggested_figure_kind": "chart",
      "suggested_chart_type": "line",
      "evidence_ids": ["ev_training_curves"]
    }
  ],
  "method_summaries": [
    {
      "summary_id": "method_figure_generation_pipeline",
      "text": "Research context -> FigureRequest builder -> Evidence binding -> Spec generation -> Renderer -> Critic and repair loop -> Final manifest",
      "target_section": "Method/Figure Generation Pipeline",
      "importance": "medium",
      "suggested_diagram_type": "pipeline",
      "evidence_ids": ["ev_pipeline_text"]
    }
  ],
  "evidence_catalog": [
    {
      "evidence_id": "ev_training_curves",
      "kind": "table_file",
      "path": "data/training_curves.csv",
      "description": "Validation accuracy and loss over six epochs for a baseline and FigureAgent-augmented method.",
      "columns": ["epoch", "method", "accuracy", "loss"],
      "row_count": 12
    },
    {
      "evidence_id": "ev_pipeline_text",
      "kind": "text_block",
      "path": null,
      "content": "Research context -> FigureRequest builder -> Evidence binding -> Spec generation -> Renderer -> Critic and repair loop -> Final manifest",
      "paragraph_ref": "Method/Figure Generation Pipeline"
    }
  ],
  "style_profile": "academic_default",
  "output_formats": ["png", "pdf"],
  "max_revision_rounds": 2
}
